Número;Gis_X;Gis_Y;Fecha de Alta;Distrito;Barrio;Calle;Nº Finca;Tipo de Reserva;Número de Plazas;Longitud;Latitud;Direccion
001a;440394,55;4474280,53;23-06-14;01  CENTRO;01-06 SOL;PUERTA DEL SOL, PLAZA, DE LA;1 B;BiciMAD;24;-37.025.753;40.417.016;PUERTA DEL SOL, PLAZA, DE LA, 1 B
001b;440404,21;4474287,39;23-06-14;01  CENTRO;01-06 SOL;ALCALA, CALLE, DE;1;BiciMAD;24;-37.024.621;404.170.785;ALCALA, CALLE, DE, 1
2;440134,83;4474678,23;23-06-14;01  CENTRO;01-05 UNIVERSIDAD;MIGUEL MOYA, CALLE, DE;1;BiciMAD;27;-37.056.739;4.042.058;MIGUEL MOYA, CALLE, DE, 1
3;440012,98;4475760,68;23-06-14;07  CHAMBERÍ;07-02 ARAPILES;CONDE DEL VALLE DE SUCHIL, PLAZA, DEL;2;BiciMAD;18;-37.072.122;404.303.224;CONDE DEL VALLE DE SUCHIL, PLAZA, DEL, 2
4;440396,4;4475565,36;23-06-14;01  CENTRO;01-05 UNIVERSIDAD;MANUELA MALASAÑA, CALLE, DE;3;BiciMAD;27;-37.026.739;404.285.905;MANUELA MALASAÑA, CALLE, DE, 3
5;440446,9;4475539,69;23-06-14;01  CENTRO;01-04 JUSTICIA;FUENCARRAL, CALLE, DE;106;BiciMAD;27;-37.020.762;404.283.628;FUENCARRAL, CALLE, DE, 106
6;440754,26;4475071,08;23-06-14;01  CENTRO;01-04 JUSTICIA;HORTALEZA, CALLE, DE;63;BiciMAD;24;-36.984.093;404.241.633;HORTALEZA, CALLE, DE, 63
7;440811,97;4475187,49;23-06-14;01  CENTRO;01-04 JUSTICIA;HORTALEZA, CALLE, DE;75;BiciMAD;21;-36.977.399;404.252.161;HORTALEZA, CALLE, DE, 75
8;441020,56;4475463,16;23-06-14;07  CHAMBERÍ;07-04 ALMAGRO;ALONSO MARTINEZ, PLAZA, DE;6;BiciMAD;24;-36.953.067;404.277.143;ALONSO MARTINEZ, PLAZA, DE, 6
9;439813,51;4474129,47;23-06-14;01  CENTRO;01-01 PALACIO;SAN MIGUEL, PLAZA, DE;9;BiciMAD;24;-37.094.093;404.156.134;SAN MIGUEL, PLAZA, DE, 9
10;441292,12;4475204,43;23-06-14;01  CENTRO;01-04 JUSTICIA;MARQUES DE LA ENSENADA, CALLE, DEL;16;BiciMAD;24;-36.920.816;404.254.027;MARQUES DE LA ENSENADA, CALLE, DEL, 16
11;440314,86;4475395,19;23-06-14;01  CENTRO;01-05 UNIVERSIDAD;SAN ANDRES, CALLE, DE;20;BiciMAD;27;-37.036.192;404.270.517;SAN ANDRES, CALLE, DE, 20
12;440095,53;4475560,73;23-06-14;01  CENTRO;01-05 UNIVERSIDAD;SAN BERNARDO, CALLE, DE;87;BiciMAD;24;-37.062.202;404.285.271;SAN BERNARDO, CALLE, DE, 87
13;439733,78;4475434,65;23-06-14;01  CENTRO;01-05 UNIVERSIDAD;CONDE DUQUE, CALLE, DEL;22;BiciMAD;27;-37.104.727;404.273.652;CONDE DUQUE, CALLE, DEL, 22
14;439478,78;4475285,54;23-06-14;09  MONCLOA-ARAVACA;09-02 ARGÜELLES;VENTURA RODRIGUEZ, CALLE, DE;2;BiciMAD;27;-37.134.644;404.260.035;VENTURA RODRIGUEZ, CALLE, DE, 2
15;440006,72;4475294,52;23-06-14;01  CENTRO;01-05 UNIVERSIDAD;SAN VICENTE FERRER, CALLE, DE;62;BiciMAD;21;-3.707.242;404.261.226;SAN VICENTE FERRER, CALLE, DE, 62
16;439982,59;4474940,94;23-06-14;01  CENTRO;01-05 UNIVERSIDAD;SAN BERNARDO, CALLE, DE;22;BiciMAD;21;-37.074.931;404.229.357;SAN BERNARDO, CALLE, DE, 22
17;440263,35;4474964,43;23-06-14;01  CENTRO;01-05 UNIVERSIDAD;CARLOS CAMBRONERO, PLAZA, DE;2;BiciMAD;27;-37.041.859;404.231.675;CARLOS CAMBRONERO, PLAZA, DE, 2
18;440653,13;4474711,92;23-06-14;01  CENTRO;01-04 JUSTICIA;PEDRO ZEROLO, PLAZA, DE;1;BiciMAD;24;-36.995.679;404.209.206;PEDRO ZEROLO, PLAZA, DE, 1
19;441008,01;4474818,09;23-06-14;01  CENTRO;01-04 JUSTICIA;PRIM, CALLE, DE;4;BiciMAD;24;-36.953.948;404.219.023;PRIM, CALLE, DE, 4
20;441021,37;4474517,89;23-06-14;01  CENTRO;01-04 JUSTICIA;ALCALA, CALLE, DE;49;BiciMAD;24;-36.952.095;404.191.989;ALCALA, CALLE, DE, 49
020 ampliacion;441014,52;4474516,49;10-07-18;01  CENTRO;01-04 JUSTICIA;ALCALA, CALLE, DE;49;BiciMAD;6;-36.952.901;404.191.858;ALCALA, CALLE, DE, 49
021a;440483,06;4474586,7;23-06-14;01  CENTRO;01-06 SOL;RED DE SAN LUIS, PLAZA, DE LA;S/N;BiciMAD;24;-37.015.608;404.197.804;RED DE SAN LUIS, PLAZA, DE LA, S/N
021b;440488,63;4474598,34;23-06-14;01  CENTRO;01-06 SOL;RED DE SAN LUIS, PLAZA, DE LA;S/N;BiciMAD;24;-37.014.962;404.198.857;RED DE SAN LUIS, PLAZA, DE LA, S/N
22;440064,4;4474630,53;23-06-14;01  CENTRO;01-06 SOL;JACOMETREZO, CALLE, DE;1;BiciMAD;24;-37.064.995;404.201.452;JACOMETREZO, CALLE, DE, 1
23;439912,56;4474639,35;23-06-14;01  CENTRO;01-01 PALACIO;SANTO DOMINGO, CUESTA, DE;S/N;BiciMAD;24;-37.082.901;404.202.137;SANTO DOMINGO, CUESTA, DE, S/N
24;439715,67;4474384,75;23-06-14;01  CENTRO;01-01 PALACIO;CARLOS III, CALLE, DE;1;BiciMAD;24;-37.105.866;40.417.906;CARLOS III, CALLE, DE, 1
025a;440104,48;4474318,99;23-06-14;01  CENTRO;01-06 SOL;CELENQUE, PLAZA, DEL;1;BiciMAD;24;-37.059.978;404.173.416;CELENQUE, PLAZA, DEL, 1
025b;440102,16;4474309,87;23-06-14;01  CENTRO;01-06 SOL;CELENQUE, PLAZA, DEL;1;BiciMAD;24;-37.060.243;404.172.593;CELENQUE, PLAZA, DEL, 1
26;441081,06;4475031,74;23-06-14;01  CENTRO;01-04 JUSTICIA;SALESAS, PLAZA, DE LAS;8;BiciMAD;24;-36.945.535;404.238.321;SALESAS, PLAZA, DE LAS, 8
27;440983,67;4473861,46;23-06-14;01  CENTRO;01-03 CORTES;JESUS, CALLE, DE;1;BiciMAD;27;-36.955.929;404.132.828;JESUS, CALLE, DE, 1
28;440712,84;4474406,69;23-06-14;01  CENTRO;01-03 CORTES;ALCALA, CALLE, DE;25;BiciMAD;24;-36.988.356;404.181.752;ALCALA, CALLE, DE, 25
29;440968,62;4474190,29;23-06-14;01  CENTRO;01-03 CORTES;MARQUES DE CUBAS, CALLE, DEL;25;BiciMAD;29;-36.958.008;40.416.244;MARQUES DE CUBAS, CALLE, DEL, 25
30;439635,83;4474544,08;23-06-14;01  CENTRO;01-01 PALACIO;PAVIA, CALLE, DE;6;BiciMAD;27;-37.115.428;404.193.355;PAVIA, CALLE, DE, 6
31;440050,38;4474208,74;23-06-14;01  CENTRO;01-06 SOL;MAYOR, CALLE;18;BiciMAD;27;-3.706.625;404.163.446;MAYOR, CALLE, 18
32;440090,59;4474042,64;23-06-14;01  CENTRO;01-06 SOL;PROVINCIA, PLAZA, DE LA;1;BiciMAD;24;-37.061.355;404.148.511;PROVINCIA, PLAZA, DE LA, 1
33;440334,9;4474112,27;23-06-14;01  CENTRO;01-06 SOL;CARRETAS, CALLE, DE LAS;23;BiciMAD;24;-37.032.626;40.415.496;CARRETAS, CALLE, DE LAS, 23
34;440313,43;4473992,08;23-06-14;01  CENTRO;01-03 CORTES;JACINTO BENAVENTE, PLAZA, DE;S/N;BiciMAD;24;-37.035.044;404.144.117;JACINTO BENAVENTE, PLAZA, DE, S/N
35;439730,93;4473970,93;23-06-14;01  CENTRO;01-01 PALACIO;CORDON, CALLE, DEL;4;BiciMAD;24;-37.103.676;404.141.792;CORDON, CALLE, DEL, 4
36;439626,96;4474272,13;23-06-14;01  CENTRO;01-01 PALACIO;RAMALES, PLAZA, DE;1;BiciMAD;24;-37.116.215;40.416.885;RAMALES, PLAZA, DE, 1
37;439409,3;4473605,14;23-06-14;01  CENTRO;01-01 PALACIO;VISTILLAS, TRAVESIA, DE LAS;S/N;BiciMAD;24;-37.141.234;404.108.606;VISTILLAS, TRAVESIA, DE LAS, S/N
38;439637;4473651,64;23-06-14;01  CENTRO;01-01 PALACIO;SAN FRANCISCO, CARRERA, DE;1;BiciMAD;24;-37.114.443;404.112.961;SAN FRANCISCO, CARRERA, DE, 1
39;439844;4473646,66;23-06-14;01  CENTRO;01-01 PALACIO;CEBADA, PLAZA, DE LA;16;BiciMAD;27;-37.090.043;404.112.662;CEBADA, PLAZA, DE LA, 16
40;440207,51;4473923,52;23-06-14;01  CENTRO;01-02 EMBAJADORES;CONDE DE ROMANONES, CALLE, DEL;2;BiciMAD;24;-37.047.463;404.137.865;CONDE DE ROMANONES, CALLE, DEL, 2
41;440689,3;4473748,28;23-06-14;01  CENTRO;01-02 EMBAJADORES;ATOCHA, CALLE, DE;54;BiciMAD;21;-36.990.517;404.122.423;ATOCHA, CALLE, DE, 54
42;440759,67;4473581,4;23-06-14;01  CENTRO;01-02 EMBAJADORES;SANTA ISABEL, CALLE, DE;32;BiciMAD;24;-36.982.068;40.410.744;SANTA ISABEL, CALLE, DE, 32
43;440391,04;4473511,6;23-06-14;01  CENTRO;01-02 EMBAJADORES;LAVAPIES, CALLE, DE;36;BiciMAD;24;-37.025.446;404.100.889;LAVAPIES, CALLE, DE, 36
44;440274,63;4473482,26;23-06-14;01  CENTRO;01-02 EMBAJADORES;MESON DE PAREDES, CALLE, DEL;35;BiciMAD;21;-37.039.138;404.098.162;MESON DE PAREDES, CALLE, DEL, 35
45;439659,26;4473169,54;23-06-14;01  CENTRO;01-02 EMBAJADORES;PUERTA DE TOLEDO, GLORIETA, DE LA;1;BiciMAD;21;-37.111.363;404.069.547;PUERTA DE TOLEDO, GLORIETA, DE LA, 1
46;439997,73;4473006,31;23-06-14;02  ARGANZUELA;02-02 ACACIAS;RIBERA DE CURTIDORES, CALLE, DE LA;28;BiciMAD;24;-37.071.322;404.055.087;RIBERA DE CURTIDORES, CALLE, DE LA, 28
47;440368,37;4472905,07;23-06-14;02  ARGANZUELA;02-02 ACACIAS;EMBAJADORES, GLORIETA, DE;7 B;BiciMAD;24;-3.702.755;404.046.233;EMBAJADORES, GLORIETA, DE, 7 B
48;440424,7;4472996,09;23-06-14;01  CENTRO;01-02 EMBAJADORES;MIGUEL SERVET, CALLE, DE;25;BiciMAD;24;-37.020.997;404.054.473;MIGUEL SERVET, CALLE, DE, 25
49;440667,66;4473061,04;23-06-14;01  CENTRO;01-02 EMBAJADORES;ATOCHA, RONDA, DE;36;BiciMAD;24;-36.992.427;404.060.497;ATOCHA, RONDA, DE, 36
50;441180,67;4473307,92;23-06-14;01  CENTRO;01-02 EMBAJADORES;SANTA ISABEL, CALLE, DE;57;BiciMAD;24;-369.322;404.083.102;SANTA ISABEL, CALLE, DE, 57
51;441148,47;4473243,04;23-06-14;01  CENTRO;01-02 EMBAJADORES;EMPERADOR CARLOS V, PLAZA, DEL;7;BiciMAD;27;-36.935.934;404.077.234;EMPERADOR CARLOS V, PLAZA, DEL, 7
52;440544,34;4474002,06;23-06-14;01  CENTRO;01-03 CORTES;SANTA ANA, PLAZA, DE;9;BiciMAD;24;-37.007.838;404.145.181;SANTA ANA, PLAZA, DE, 9
53;440543,46;4473309,62;23-06-14;01  CENTRO;01-02 EMBAJADORES;VALENCIA, CALLE, DE;4;BiciMAD;24;-37.007.295;404.082.802;VALENCIA, CALLE, DE, 4
54;440592,35;4475345,44;23-06-14;01  CENTRO;01-04 JUSTICIA;BARCELO, CALLE, DE;7;BiciMAD;21;-37.003.435;404.266.233;BARCELO, CALLE, DE, 7
55;440455,56;4475063,26;23-06-14;01  CENTRO;01-05 UNIVERSIDAD;SAN ILDEFONSO, PLAZA, DE;8;BiciMAD;24;-37.019.295;404.240.716;SAN ILDEFONSO, PLAZA, DE, 8
56;440335,43;4474443,96;23-06-14;01  CENTRO;01-06 SOL;CARMEN, PLAZA, DEL;1;BiciMAD;27;-37.032.875;40.418.484;CARMEN, PLAZA, DEL, 1
57;439536,86;4475688,34;23-06-14;01  CENTRO;01-05 UNIVERSIDAD;SANTA CRUZ DE MARCENADO, CALLE, DE;24;BiciMAD;27;-37.128.181;404.296.363;SANTA CRUZ DE MARCENADO, CALLE, DE, 24
58;440792,31;4474859,33;23-06-14;01  CENTRO;01-04 JUSTICIA;AUGUSTO FIGUEROA, CALLE, DE;33;BiciMAD;27;-36.979.411;404.222.585;AUGUSTO FIGUEROA, CALLE, DE, 33
59;440271,27;4475221,1;23-06-14;01  CENTRO;01-05 UNIVERSIDAD;ESPIRITU SANTO, CALLE, DEL;30;BiciMAD;21;-37.041.167;404.254.802;ESPIRITU SANTO, CALLE, DEL, 30
60;441616,3;4474541,2;23-06-14;03  RETIRO;03-05 JERÓNIMOS;ALFONSO XII, CALLE, DE;S/N;BiciMAD;27;-36.881.994;404.194.508;ALFONSO XII, CALLE, DE, S/N
61;442720,29;4474753,26;23-06-14;03  RETIRO;03-04 IBIZA;O'DONNELL, CALLE, DE;30;BiciMAD;24;-3.675.206;404.214.379;O'DONNELL, CALLE, DE, 30
62;443105,21;4474725,61;23-06-14;03  RETIRO;03-04 IBIZA;O'DONNELL, CALLE, DE;S/N;BiciMAD;27;-36.706.664;404.212.152;O'DONNELL, CALLE, DE, S/N
63;443101,23;4474356,23;23-06-14;03  RETIRO;03-04 IBIZA;IBIZA, CALLE, DE;64;BiciMAD;24;-36.706.803;404.178.874;IBIZA, CALLE, DE, 64
65;441513,54;4474236,11;23-06-14;03  RETIRO;03-05 JERÓNIMOS;ANTONIO MAURA, CALLE, DE;15;BiciMAD;24;-36.893.825;404.166.952;ANTONIO MAURA, CALLE, DE, 15
67;441190,08;4473587,45;23-06-14;01  CENTRO;01-03 CORTES;ALMADEN, CALLE, DE;28;BiciMAD;67;-36.931.349;40.410.829;ALMADEN, CALLE, DE, 28
68;441358,92;4473802,81;23-06-14;03  RETIRO;03-05 JERÓNIMOS;ESPALTER, CALLE, DE;1;BiciMAD;21;-36.911.649;40.412.781;ESPALTER, CALLE, DE, 1
69;441551,54;4473499,36;23-06-14;03  RETIRO;03-05 JERÓNIMOS;ALFONSO XII, CALLE, DE;54;BiciMAD;27;-36.888.669;404.100.609;ALFONSO XII, CALLE, DE, 54
70;442496,79;4474058,47;23-06-14;03  RETIRO;03-05 JERÓNIMOS;MENENDEZ PELAYO, AVENIDA, DE;S/N;BiciMAD;27;-36.777.776;404.151.635;MENENDEZ PELAYO, AVENIDA, DE, S/N
71;442816,22;4474149,49;23-06-14;03  RETIRO;03-06 NIÑO JESÚS;DOCE DE OCTUBRE, CALLE, DEL;28;BiciMAD;24;-3.674.021;404.160.054;DOCE DE OCTUBRE, CALLE, DEL, 28
72;443219,95;4474136,22;23-06-14;03  RETIRO;03-03 ESTRELLA;DOCTOR ESQUERDO, CALLE, DEL;99;BiciMAD;24;-36.692.614;404.159.135;DOCTOR ESQUERDO, CALLE, DEL, 99
73;443229,99;4473642,11;23-06-14;03  RETIRO;03-03 ESTRELLA;ASTROS, PLAZA, DE LOS;S/N;BiciMAD;24;-3.669.099;40.411.463;ASTROS, PLAZA, DE LOS, S/N
74;442595,78;4473679,92;23-06-14;03  RETIRO;03-05 JERÓNIMOS;MENENDEZ PELAYO, AVENIDA, DE;S/N;BiciMAD;27;-36.765.768;404.117.601;MENENDEZ PELAYO, AVENIDA, DE, S/N
75;442436,91;4473301,34;23-06-14;03  RETIRO;03-05 JERÓNIMOS;MENENDEZ PELAYO, AVENIDA, DE;S/N;BiciMAD;27;-36.784.149;404.083.387;MENENDEZ PELAYO, AVENIDA, DE, S/N
76;442712,67;4473182,27;23-06-14;03  RETIRO;03-06 NIÑO JESÚS;JUAN DE URBIETA, CALLE, DE;48;BiciMAD;24;-36.751.544;404.072.851;JUAN DE URBIETA, CALLE, DE, 48
77;443083,53;4473073,95;23-06-14;03  RETIRO;03-01 PACÍFICO;CONDE DE CASAL, PLAZA, DEL;8;BiciMAD;24;-36.707.742;404.063.347;CONDE DE CASAL, PLAZA, DEL, 8
78;442755,86;4472436,57;23-06-14;03  RETIRO;03-02 ADELFAS;CERRO DE LA PLATA, CALLE, DEL;2;BiciMAD;24;-36.745.783;404.005.704;CERRO DE LA PLATA, CALLE, DEL, 2
79;442252,73;4472937,49;23-06-14;03  RETIRO;03-01 PACÍFICO;MENENDEZ PELAYO, AVENIDA, DE;38;BiciMAD;24;-36.805.524;404.050.482;MENENDEZ PELAYO, AVENIDA, DE, 38
080a;441417,53;4473211,23;23-06-14;03  RETIRO;03-05 JERÓNIMOS;CIUDAD DE BARCELONA, AVENIDA, DE LA;S/N;BiciMAD;24;-36.904.197;404.074.558;CIUDAD DE BARCELONA, AVENIDA, DE LA, S/N
080b;441394,74;4473233,56;23-06-14;03  RETIRO;03-05 JERÓNIMOS;CIUDAD DE BARCELONA, AVENIDA, DE LA;S/N;BiciMAD;24;-36.906.904;404.076.554;CIUDAD DE BARCELONA, AVENIDA, DE LA, S/N
81;441288,14;4473447,57;23-06-14;03  RETIRO;03-05 JERÓNIMOS;PRADO, PASEO, DEL;S/N;BiciMAD;24;-36.919.663;404.095.758;PRADO, PASEO, DEL, S/N
82;443177,93;4473311,29;23-06-14;03  RETIRO;03-03 ESTRELLA;LIRA, CALLE, DE LA;2;BiciMAD;24;-3.669.683;404.084.793;LIRA, CALLE, DE LA, 2
83;442770,38;4473844,96;23-06-14;03  RETIRO;03-06 NIÑO JESÚS;PIO BAROJA, CALLE, DE;8 B;BiciMAD;24;-36.745.339;404.132.589;PIO BAROJA, CALLE, DE, 8 B
84;442918,27;4472746,05;23-06-14;03  RETIRO;03-02 ADELFAS;DOCTOR ESQUERDO, CALLE, DEL;191;BiciMAD;27;-36.726.923;404.033.695;DOCTOR ESQUERDO, CALLE, DEL, 191
85;442319,29;4474723,43;23-06-14;03  RETIRO;03-05 JERÓNIMOS;MENENDEZ PELAYO, AVENIDA, DE;S/N;BiciMAD;27;-36.799.299;404.211.415;MENENDEZ PELAYO, AVENIDA, DE, S/N
86;441180,29;4474447,71;22-09-14;01  CENTRO;01-03 CORTES;PRADO, PASEO, DEL;S/N;BiciMAD;21;-36.933.298;404.185.779;PRADO, PASEO, DEL, S/N
87;442016,68;4475450,66;23-06-14;04  SALAMANCA;04-01 RECOLETOS;AYALA, CALLE, DE;44;BiciMAD;24;-36.835.631;404.276.717;AYALA, CALLE, DE, 44
88;442004,11;4475843,28;23-06-14;04  SALAMANCA;04-06 CASTELLANA;VELAZQUEZ, CALLE, DE;73;BiciMAD;24;-36.837.471;404.312.077;VELAZQUEZ, CALLE, DE, 73
89;442728,15;4475399,8;23-06-14;04  SALAMANCA;04-02 GOYA;AYALA, CALLE, DE;102;BiciMAD;24;-36.751.716;404.272.628;AYALA, CALLE, DE, 102
90;442000,33;4475163,96;23-06-14;04  SALAMANCA;04-01 RECOLETOS;GOYA, CALLE, DE;18;BiciMAD;24;-36.837.297;404.250.878;GOYA, CALLE, DE, 18
91;442417,66;4475274,35;23-06-14;04  SALAMANCA;04-02 GOYA;HERMOSILLA, CALLE, DE;73;BiciMAD;24;-36.788.203;404.261.113;HERMOSILLA, CALLE, DE, 73
92;441767,83;4475291,85;23-06-14;04  SALAMANCA;04-01 RECOLETOS;CLAUDIO COELLO, CALLE, DE;45;BiciMAD;24;-36.864.821;404.262.237;CLAUDIO COELLO, CALLE, DE, 45
93;441518,8;4475235,48;23-06-14;04  SALAMANCA;04-01 RECOLETOS;GOYA, CALLE, DE;3;BiciMAD;24;-36.894.124;404.256.984;GOYA, CALLE, DE, 3
94;441407,18;4474977,73;23-06-14;04  SALAMANCA;04-01 RECOLETOS;RECOLETOS, PASEO, DE;S/N;BiciMAD;24;-36.907.044;404.233.686;RECOLETOS, PASEO, DE, S/N
95;441721,55;4474897;23-06-14;04  SALAMANCA;04-01 RECOLETOS;CLAUDIO COELLO, CALLE, DE;19;BiciMAD;24;-36.869.914;404.226.634;CLAUDIO COELLO, CALLE, DE, 19
96;442140,46;4474825,84;23-06-14;04  SALAMANCA;04-01 RECOLETOS;ALCALA, CALLE, DE;111;BiciMAD;27;-36.820.471;404.220.516;ALCALA, CALLE, DE, 111
97;442301,64;4474872,66;23-06-14;04  SALAMANCA;04-02 GOYA;MENENDEZ PELAYO, AVENIDA, DE;1;BiciMAD;24;-36.801.515;404.224.846;MENENDEZ PELAYO, AVENIDA, DE, 1
98;442705,5;4475058,99;23-06-14;04  SALAMANCA;04-02 GOYA;FELIPE II, AVENIDA, DE;5;BiciMAD;24;-36.754.079;404.241.911;FELIPE II, AVENIDA, DE, 5
99;442829,62;4475270,48;23-06-14;04  SALAMANCA;04-02 GOYA;ALCANTARA, CALLE, DE;2;BiciMAD;24;-36.739.638;404.261.048;ALCANTARA, CALLE, DE, 2
100;442835,81;4475123,85;23-06-14;04  SALAMANCA;04-02 GOYA;GOYA, CALLE, DE;99;BiciMAD;24;-36.738.777;404.247.843;GOYA, CALLE, DE, 99
101;443212,16;4474936,49;23-06-14;04  SALAMANCA;04-02 GOYA;JORGE JUAN, CALLE, DE;131;BiciMAD;24;-36.694.246;404.231.223;JORGE JUAN, CALLE, DE, 131
102;441967,18;4474727,67;23-06-14;04  SALAMANCA;04-01 RECOLETOS;ALCALA, CALLE, DE;95;BiciMAD;24;-36.840.806;404.211.552;ALCALA, CALLE, DE, 95
103;441766,91;4475752,49;23-06-14;04  SALAMANCA;04-06 CASTELLANA;JOSE ORTEGA Y GASSET, CALLE, DE;4;BiciMAD;24;-36.865.351;404.303.733;JOSE ORTEGA Y GASSET, CALLE, DE, 4
104;441505,58;4475354,07;23-06-14;04  SALAMANCA;04-01 RECOLETOS;CASTELLANA, PASEO, DE LA;4;BiciMAD;21;-36.895.792;404.267.658;CASTELLANA, PASEO, DE LA, 4
105;441684,37;4475386,27;23-06-14;04  SALAMANCA;04-01 RECOLETOS;SERRANO, CALLE, DE;46;BiciMAD;24;-36.874.745;404.270.684;SERRANO, CALLE, DE, 46
106;441648,47;4475149,56;23-06-14;04  SALAMANCA;04-01 RECOLETOS;SERRANO, CALLE, DE;32;BiciMAD;36;-3.687.876;404.249.335;SERRANO, CALLE, DE, 32
107;441599,07;4474779,37;23-06-14;04  SALAMANCA;04-01 RECOLETOS;SERRANO, CALLE, DE;8;BiciMAD;24;-36.884.243;404.215.952;SERRANO, CALLE, DE, 8
108;443111,6;4475416,83;23-06-14;04  SALAMANCA;04-02 GOYA;MARTIRES CONCEPCIONISTAS, CALLE, DE LOS;2;BiciMAD;24;-3.670.653;404.274.425;MARTIRES CONCEPCIONISTAS, CALLE, DE LOS, 2
109;442191,64;4475721,98;23-06-14;04  SALAMANCA;04-06 CASTELLANA;JOSE ORTEGA Y GASSET, CALLE, DE;32;BiciMAD;24;-36.815.253;404.301.281;JOSE ORTEGA Y GASSET, CALLE, DE, 32
110;438921,15;4476262,7;23-06-14;09  MONCLOA-ARAVACA;09-01 CASA DE CAMPO;MORET, PASEO, DE;S/N;BiciMAD;24;-37.201.316;404.347.654;MORET, PASEO, DE, S/N
111a;439144,16;4476128,65;23-06-14;07  CHAMBERÍ;07-01 GAZTAMBIDE;ARCIPRESTE DE HITA, CALLE, DEL;8;BiciMAD;24;-37.174.896;404.335.742;ARCIPRESTE DE HITA, CALLE, DEL, 8
111b;439120,04;4476174,12;23-06-14;07  CHAMBERÍ;07-01 GAZTAMBIDE;ARCIPRESTE DE HITA, CALLE, DEL;10;BiciMAD;24;-37.177.783;40.433.982;ARCIPRESTE DE HITA, CALLE, DEL, 10
112;438517,07;4476028,6;23-06-14;09  MONCLOA-ARAVACA;09-02 ARGÜELLES;MORET, PASEO, DE;11;BiciMAD;24;-37.248.727;404.326.267;MORET, PASEO, DE, 11
113;438865,35;4475484,09;23-06-14;09  MONCLOA-ARAVACA;09-01 CASA DE CAMPO;PINTOR ROSALES, PASEO, DEL;S/N;BiciMAD;24;-37.207.145;404.277.472;PINTOR ROSALES, PASEO, DEL, S/N
114;439145,66;4475489,87;23-06-14;09  MONCLOA-ARAVACA;09-02 ARGÜELLES;QUINTANA, CALLE, DE;13;BiciMAD;24;-37.174.108;404.278.199;QUINTANA, CALLE, DE, 13
115;439181,48;4475218,76;23-06-14;09  MONCLOA-ARAVACA;09-02 ARGÜELLES;MARQUES DE CERRALBO, PLAZA, DEL;S/N;BiciMAD;24;-37.169.626;404.253.802;MARQUES DE CERRALBO, PLAZA, DEL, S/N
116a;439616,59;4475074,01;23-06-14;09  MONCLOA-ARAVACA;09-02 ARGÜELLES;ESPAÑA, PLAZA, DE;S/N;BiciMAD;24;-37.118.199;404.241.079;ESPAÑA, PLAZA, DE, S/N
116b;439610,68;4475084,23;23-06-14;09  MONCLOA-ARAVACA;09-02 ARGÜELLES;ESPAÑA, PLAZA, DE;S/N;BiciMAD;24;-37.118.905;404.241.996;ESPAÑA, PLAZA, DE, S/N
117;439020,83;4475833,31;26-06-14;09  MONCLOA-ARAVACA;09-02 ARGÜELLES;ALTAMIRANO, CALLE, DE;24;BiciMAD;24;-37.189.152;404.309.046;ALTAMIRANO, CALLE, DE, 24
118;441605,27;4472470,69;23-06-14;02  ARGANZUELA;02-06 PALOS DE MOGUER;JUAN MARTIN EL EMPECINADO, CALLE, DE;16;BiciMAD;24;-36.881.393;404.007.979;JUAN MARTIN EL EMPECINADO, CALLE, DE, 16
119;441738,36;4472542,79;23-06-14;02  ARGANZUELA;02-07 ATOCHA;MENDEZ ALVARO, CALLE, DE;7;BiciMAD;24;-36.865.777;404.014.567;MENDEZ ALVARO, CALLE, DE, 7
120;441058,14;4472722,16;23-06-14;02  ARGANZUELA;02-06 PALOS DE MOGUER;PALOS DE LA FRONTERA, CALLE, DE;27;BiciMAD;24;-36.946.097;404.030.247;PALOS DE LA FRONTERA, CALLE, DE, 27
121;440718,1;4472592,85;23-06-14;02  ARGANZUELA;02-06 PALOS DE MOGUER;SANTA MARIA DE LA CABEZA, PASEO, DE;58;BiciMAD;24;-36.986.046;404.018.356;SANTA MARIA DE LA CABEZA, PASEO, DE, 58
122;440941,06;4475664,68;23-06-14;07  CHAMBERÍ;07-04 ALMAGRO;SANTA ENGRACIA, CALLE, DE;16;BiciMAD;24;-36.962.626;40.429.524;SANTA ENGRACIA, CALLE, DE, 16
123;439482,59;4475800,04;23-06-14;07  CHAMBERÍ;07-01 GAZTAMBIDE;GUZMAN EL BUENO, CALLE, DE;2;BiciMAD;24;-37.134.685;404.306.386;GUZMAN EL BUENO, CALLE, DE, 2
124;440683,01;4475810,28;01-07-15;07  CHAMBERÍ;07-03 TRAFALGAR;MANUEL SILVELA, CALLE, DE;18;BiciMAD;24;-36.993.182;404.308.173;MANUEL SILVELA, CALLE, DE, 18
125;441066,99;4476306,47;01-07-15;07  CHAMBERÍ;07-04 ALMAGRO;FERNANDEZ DE LA HOZ, CALLE, DE;29;BiciMAD;24;-36.948.375;404.353.145;FERNANDEZ DE LA HOZ, CALLE, DE, 29
126;440480,69;4476228,15;01-07-15;07  CHAMBERÍ;07-03 TRAFALGAR;GENERAL ALVAREZ DE CASTRO, CALLE, DEL;4;BiciMAD;24;-37.017.424;404.345.672;GENERAL ALVAREZ DE CASTRO, CALLE, DEL, 4
127;439915,53;4476159,48;01-07-15;07  CHAMBERÍ;07-02 ARAPILES;FERNANDO EL CATOLICO, CALLE, DE;19;BiciMAD;24;-37.083.987;40.433.908;FERNANDO EL CATOLICO, CALLE, DE, 19
128;439310,29;4476734,2;01-07-15;07  CHAMBERÍ;07-01 GAZTAMBIDE;CEA BERMUDEZ, CALLE, DE;59;BiciMAD;24;-37.155.889;404.390.413;CEA BERMUDEZ, CALLE, DE, 59
129;440776,2;4476658,18;01-07-15;07  CHAMBERÍ;07-05 RÍOS ROSAS;JOSE ABASCAL, CALLE, DE;33;BiciMAD;24;-36.982.986;404.384.622;JOSE ABASCAL, CALLE, DE, 33
130;440485,91;4477025,58;21-06-17;07  CHAMBERÍ;07-05 RÍOS ROSAS;SANTA ENGRACIA, CALLE, DE;129;BiciMAD;18;-37.017.555;404.417.512;SANTA ENGRACIA, CALLE, DE, 129
131;440293,58;4477026,74;01-07-15;07  CHAMBERÍ;07-05 RÍOS ROSAS;BRAVO MURILLO, CALLE, DE;44;BiciMAD;24;-37.040.233;404.417.479;BRAVO MURILLO, CALLE, DE, 44
132;440334,34;4477541,61;01-07-15;07  CHAMBERÍ;07-05 RÍOS ROSAS;SANTA ENGRACIA, CALLE, DE;168;BiciMAD;24;-37.035.911;404.463.889;SANTA ENGRACIA, CALLE, DE, 168
133;440637,08;4477625,61;01-07-15;06  TETUÁN;06-02 CUATRO CAMINOS;DULCINEA, CALLE, DE;3;BiciMAD;24;-37.000.292;404.471.673;DULCINEA, CALLE, DE, 3
134;441017,64;4477274,53;01-07-15;07  CHAMBERÍ;07-05 RÍOS ROSAS;MARIA DE GUZMAN, CALLE, DE;58;BiciMAD;24;-36.955.092;404.440.317;MARIA DE GUZMAN, CALLE, DE, 58
135;441237,58;4476989,99;01-04-15;07  CHAMBERÍ;07-05 RÍOS ROSAS;SAN JUAN DE LA CRUZ, PLAZA, DE;S/N;BiciMAD;24;-36.928.896;40.441.484;SAN JUAN DE LA CRUZ, PLAZA, DE, S/N
136;441417,02;4477410,33;01-07-15;05  CHAMARTÍN;05-01 EL VISO;CASTELLANA, PASEO, DE LA;106;BiciMAD;24;-36.908.127;404.452.833;CASTELLANA, PASEO, DE LA, 106
137;441885,33;4477430,27;01-07-15;05  CHAMARTÍN;05-01 EL VISO;REPUBLICA ARGENTINA, PLAZA, DE LA;6;BiciMAD;24;-36.852.925;404.454.958;REPUBLICA ARGENTINA, PLAZA, DE LA, 6
138;441352,15;4477455,81;01-07-15;07  CHAMBERÍ;07-05 RÍOS ROSAS;CASTELLANA, PASEO, DE LA;S/N;BiciMAD;24;-36.915.818;404.456.884;CASTELLANA, PASEO, DE LA, S/N
139;441442,67;4476752,13;01-07-15;05  CHAMARTÍN;05-01 EL VISO;JOSE GUTIERREZ ABASCAL, CALLE, DE;S/N;BiciMAD;24;-36.904.495;404.393.558;JOSE GUTIERREZ ABASCAL, CALLE, DE, S/N
140;442081,57;4476664,17;01-07-15;05  CHAMARTÍN;05-01 EL VISO;VELAZQUEZ, CALLE, DE;134;BiciMAD;24;-36.829.088;404.386.081;VELAZQUEZ, CALLE, DE, 134
141;441537,59;4476315,08;01-07-15;07  CHAMBERÍ;07-04 ALMAGRO;CASTELLANA, PASEO, DE LA;43;BiciMAD;24;-36.892.902;404.354.253;CASTELLANA, PASEO, DE LA, 43
142;441641,97;4476103,45;01-07-15;04  SALAMANCA;04-06 CASTELLANA;CASTELLANA, PASEO, DE LA;S/N;BiciMAD;24;-36.880.402;404.335.262;CASTELLANA, PASEO, DE LA, S/N
143;442474,52;4476217,99;01-07-15;04  SALAMANCA;04-05 LISTA;DIEGO DE LEON, CALLE, DE;54;BiciMAD;24;-36.782.355;40.434.616;DIEGO DE LEON, CALLE, DE, 54
144;442707,74;4475961,24;20-06-15;04  SALAMANCA;04-05 LISTA;JUAN BRAVO, CALLE, DE;50;BiciMAD;24;-36.754.628;404.323.192;JUAN BRAVO, CALLE, DE, 50
145;443050,11;4475675,85;01-07-15;04  SALAMANCA;04-05 LISTA;JOSE ORTEGA Y GASSET, CALLE, DE;87;BiciMAD;24;-3.671.401;404.297.717;JOSE ORTEGA Y GASSET, CALLE, DE, 87
146;442434,99;4477286,31;20-06-15;05  CHAMARTÍN;05-01 EL VISO;MARIA FRANCISCA, CALLE, DE;1;BiciMAD;24;-36.787.983;404.442.372;MARIA FRANCISCA, CALLE, DE, 1
147;442372,1;4477741,71;01-07-15;05  CHAMARTÍN;05-01 EL VISO;DOCTOR ARCE, AVENIDA, DEL;45;BiciMAD;24;-36.795.811;404.483.353;DOCTOR ARCE, AVENIDA, DEL, 45
148;442194,62;4478041,41;01-07-15;05  CHAMARTÍN;05-01 EL VISO;SERRANO, CALLE, DE;210;BiciMAD;24;-36.817.012;404.510.228;SERRANO, CALLE, DE, 210
149;441672,37;4477914,72;01-07-15;05  CHAMARTÍN;05-01 EL VISO;LA HABANA, PASEO, DE;42;BiciMAD;24;-36.878.481;40.449.845;LA HABANA, PASEO, DE, 42
150;441443,71;4477839,96;01-07-15;05  CHAMARTÍN;05-01 EL VISO;CASTELLANA, PASEO, DE LA;S/N;BiciMAD;24;-36.905.376;404.491.555;CASTELLANA, PASEO, DE LA, S/N
151;441047,09;4477810,46;01-07-15;06  TETUÁN;06-02 CUATRO CAMINOS;ORENSE, CALLE, DE;10;BiciMAD;24;-36.952.117;404.488.617;ORENSE, CALLE, DE, 10
152;440733,5;4478240,82;01-07-15;06  TETUÁN;06-02 CUATRO CAMINOS;GENERAL PERON, AVENIDA, DEL;S/N;BiciMAD;24;-36.989.497;404.527.163;GENERAL PERON, AVENIDA, DEL, S/N
153;441229,67;4478195,07;01-07-15;06  TETUÁN;06-02 CUATRO CAMINOS;GENERAL PERON, AVENIDA, DEL;S/N;BiciMAD;24;-36.930.944;404.523.394;GENERAL PERON, AVENIDA, DEL, S/N
154;441096,52;4478466,6;01-07-15;06  TETUÁN;06-02 CUATRO CAMINOS;ORENSE, CALLE, DE;36;BiciMAD;24;-36.946.897;40.454.776;ORENSE, CALLE, DE, 36
155;440572,97;4478750,49;01-07-15;06  TETUÁN;06-02 CUATRO CAMINOS;SAN GERMÁN, CALLE, DE;55;BiciMAD;24;-37.008.905;404.572.961;SAN GERMÁN, CALLE, DE, 55
156;441385,88;4478959,93;01-07-15;06  TETUÁN;06-03 CASTILLEJOS;SOR ANGELA DE LA CRUZ, CALLE, DE;S/N;BiciMAD;24;-36.913.229;404.592.406;SOR ANGELA DE LA CRUZ, CALLE, DE, S/N
157;441554,84;4478963,2;01-07-15;05  CHAMARTÍN;05-05 NUEVA ESPAÑA;CASTELLANA, PASEO, DE LA;S/N;BiciMAD;24;-36.893.305;40.459.282;CASTELLANA, PASEO, DE LA, S/N
158;441946,46;4478886,67;01-07-15;05  CHAMARTÍN;05-04 HISPANOAMÉRICA;ALBERTO ALCOCER, AVENIDA, DE;22 A;BiciMAD;24;-36.847.049;4.045.862;ALBERTO ALCOCER, AVENIDA, DE, 22 A
159;442024,96;4478401,51;01-07-15;05  CHAMARTÍN;05-04 HISPANOAMÉRICA;LA HABANA, PASEO, DE;63;BiciMAD;24;-36.837.348;404.542.549;LA HABANA, PASEO, DE, 63
160;442637,46;4478722,46;01-07-15;05  CHAMARTÍN;05-04 HISPANOAMÉRICA;COLOMBIA, CALLE, DE;7;BiciMAD;24;-36.765.407;404.571.887;COLOMBIA, CALLE, DE, 7
161;438748,24;4474860,98;01-07-15;09  MONCLOA-ARAVACA;09-01 CASA DE CAMPO;FLORIDA, PASEO, DE LA;8;BiciMAD;24;-3.722.035;404.221.254;FLORIDA, PASEO, DE LA, 8
162;439688,47;4472787,76;01-07-15;02  ARGANZUELA;02-02 ACACIAS;OLMOS, PASEO, DE LOS;28;BiciMAD;24;-37.107.559;404.035.176;OLMOS, PASEO, DE LOS, 28
163;440055,04;4472797,85;01-07-15;02  ARGANZUELA;02-02 ACACIAS;ESPERANZA, PASEO, DE LA;0,083333333;BiciMAD;24;-37.064.372;404.036.349;ESPERANZA, PASEO, DE LA, 0,0833333333333333
